<?xml version="1.0" encoding="UTF-8"?>
<creatures xmlns="stendhal" xmlns:xsi="http://www.w3.org/2001/XMLSchema-instance"
	xsi:schemaLocation="stendhal ../creatures.xsd ">

	<!-- START: wilkolaki -->

	<creature name="werewolf sellsword">
		<type class="pol/wilkolaki" subclass="wilkolak_zoldak" tileid="pol_wilkolaki.png:0"/>
		<description>You see a mercenary werewolf prowling under the full moon.</description>
		<attributes>
			<atk value="1250"/>
			<def value="149"/>
			<hp value="1290"/>
			<speed value="0.8"/>
			<size value="1,1"/>
		</attributes>
		<level value="159"/>
		<experience value="9110"/>
		<respawn value="5110"/>
		<corpse name="animal"/>
		<drops>
			<item value="money" quantity="[29,129]" probability="100.0"/>
			<item value="green dragon cloak" quantity="[1,1]" probability="10.0"/>
			<item value="emerald" quantity="[1,1]" probability="1.0"/>
		</drops>
		<equips/>
		<ai>
			<profile name="brave"/>
			<profile name="offensive"/>
			<profile name="human"/>
			<profile name="patrolling"/>
			<profile name="heal" params="5,50"/>
		</ai>
	</creature>

	<creature name="werewolf warrior">
		<type class="pol/wilkolaki" subclass="wilkolak_wojak" tileid="pol_wilkolaki.png:1"/>
		<description>You see a ferocious werewolf warrior thirsting for battle.</description>
		<attributes>
			<atk value="1450"/>
			<def value="169"/>
			<hp value="1590"/>
			<speed value="0.9"/>
			<size value="1,1"/>
		</attributes>
		<level value="161"/>
		<experience value="9310"/>
		<respawn value="7510"/>
		<corpse name="animal"/>
		<drops>
			<item value="money" quantity="[29,129]" probability="100.0"/>
			<item value="green dragon cloak" quantity="[1,1]" probability="20.0"/>
			<item value="emerald" quantity="[1,1]" probability="10.0"/>
		</drops>
		<equips/>
		<ai>
			<profile name="brave"/>
			<profile name="offensive"/>
			<profile name="human"/>
			<profile name="patrolling"/>
			<profile name="heal" params="5,50"/>
		</ai>
	</creature>

	<creature name="werewolf archer">
		<type class="pol/wilkolaki" subclass="wilkolak_lucznik" tileid="pol_wilkolaki.png:2"/>
		<description>You see a werewolf archer stalking prey from the treetops.</description>
		<attributes>
			<atk value="1950"/>
			<def value="109"/>
			<hp value="790"/>
			<speed value="1.0"/>
			<size value="1,1"/>
		</attributes>
		<level value="151"/>
		<experience value="8310"/>
		<respawn value="3510"/>
		<corpse name="animal"/>
		<drops>
			<item value="money" quantity="[129,329]" probability="90.0"/>
			<item value="green dragon cloak" quantity="[1,1]" probability="25.0"/>
			<item value="emerald" quantity="[1,1]" probability="15.0"/>
			<item value="longbow" quantity="[1,1]" probability="7.5"/>
		</drops>
		<equips>
			<slot name="lhand" item="wooden arrow" quantity="10000"/>
			<slot name="rhand" item="longbow" quantity="1"/>
		</equips>
		<ai>
			<profile name="brave"/>
			<profile name="offensive"/>
			<profile name="human"/>
			<profile name="archer"/>
			<profile name="patrolling"/>
			<profile name="heal" params="5,50"/>
		</ai>
	</creature>

	<creature name="werewolf guardian">
		<type class="pol/wilkolaki" subclass="wilkolak_lider" tileid="pol_wilkolaki.png:3"/>
		<description>You see an armored werewolf guardian defending the pack.</description>
		<attributes>
			<atk value="1150"/>
			<def value="769"/>
			<hp value="1790"/>
			<speed value="0.7"/>
			<size value="1,1"/>
		</attributes>
		<level value="141"/>
		<experience value="7310"/>
		<respawn value="3510"/>
		<corpse name="animal"/>
		<drops>
			<item value="money" quantity="[29,129]" probability="100.0"/>
			<item value="green dragon cloak" quantity="[1,1]" probability="10.0"/>
			<item value="emerald" quantity="[1,1]" probability="1.0"/>
			<item value="green dragon shield" quantity="[1,1]" probability="2.5"/>
		</drops>
		<equips/>
		<ai>
			<profile name="brave"/>
			<profile name="offensive"/>
			<profile name="human"/>
			<profile name="patrolling"/>
			<profile name="heal" params="5,50"/>
		</ai>
	</creature>

	<creature name="werewolf stalker">
		<type class="pol/wilkolaki" subclass="wilkolak_zwiadowca" tileid="pol_wilkolaki.png:4"/>
		<description>You see a swift werewolf stalker tracking your scent.</description>
		<attributes>
			<atk value="1750"/>
			<def value="269"/>
			<hp value="1990"/>
			<speed value="0.9"/>
			<size value="1,1"/>
		</attributes>
		<level value="171"/>
		<experience value="9910"/>
		<respawn value="3510"/>
		<corpse name="animal"/>
		<drops>
			<item value="money" quantity="[29,129]" probability="100.0"/>
			<item value="green dragon cloak" quantity="[1,1]" probability="10.0"/>
			<item value="emerald" quantity="[1,1]" probability="1.0"/>
			<item value="dagger" quantity="[1,1]" probability="22.5"/>
		</drops>
		<equips/>
		<ai>
			<profile name="brave"/>
			<profile name="offensive"/>
			<profile name="human"/>
			<profile name="patrolling"/>
			<profile name="heal" params="5,50"/>
		</ai>
	</creature>

	<creature name="werewolf shaman">
		<type class="pol/wilkolaki" subclass="wilkolak_szaman" tileid="pol_wilkolaki.png:5"/>
		<description>You see a mystical werewolf shaman channeling primal blood magic.</description>
		<attributes>
			<atk value="1750"/>
			<def value="269"/>
			<hp value="1990"/>
			<speed value="0.9"/>
			<size value="1,1"/>
		</attributes>
		<level value="171"/>
		<experience value="9910"/>
		<respawn value="3510"/>
		<corpse name="animal"/>
		<drops>
			<item value="money" quantity="[9,29]" probability="100.0"/>
			<item value="black dragon cloak" quantity="[1,1]" probability="5.0"/>
			<item value="emerald" quantity="[1,1]" probability="1.0"/>
			<item value="greater antidote" quantity="[1,2]" probability="20.0"/>
		</drops>
		<equips>
			<slot name="lhand" item="wooden arrow" quantity="10000"/>
			<slot name="rhand" item="longbow" quantity="1"/>
		</equips>
		<ai>
			<profile name="brave"/>
			<profile name="offensive"/>
			<profile name="human"/>
			<profile name="heal" params="10,60"/>
			<profile name="patrolling"/>
		</ai>
	</creature>

	<creature name="werewolf princess">
		<type class="pol/wilkolaki" subclass="wilkolak_ksiezniczka" tileid="pol_wilkolaki.png:6"/>
		<description>You see the royal werewolf princess commanding her pack.</description>
		<attributes>
			<atk value="2150"/>
			<def value="369"/>
			<hp value="2990"/>
			<speed value="1.0"/>
			<size value="1,1"/>
		</attributes>
		<level value="191"/>
		<experience value="9910"/>
		<respawn value="3510"/>
		<corpse name="animal"/>
		<drops>
			<item value="money" quantity="[9,329]" probability="100.0"/>
			<item value="blue striped cloak" quantity="[1,1]" probability="15.0"/>
			<item value="sapphire" quantity="[1,1]" probability="31.0"/>
			<item value="pelt" quantity="[1,1]" probability="50.0"/>
			<item value="greater antidote" quantity="[1,2]" probability="20.0"/>
		</drops>
		<equips/>
		<ai>
			<profile name="brave"/>
			<profile name="offensive"/>
			<profile name="human"/>
			<profile name="heal" params="10,60"/>
			<profile name="patrolling"/>
		</ai>
	</creature>

	<creature name="werewolf prince">
		<type class="pol/wilkolaki" subclass="wilkolak_ksiaze" tileid="pol_wilkolaki.png:7"/>
		<description>You see the fearsome werewolf prince ruling the mountain wilderness.</description>
		<attributes>
			<atk value="2350"/>
			<def value="469"/>
			<hp value="2990"/>
			<speed value="1.0"/>
			<size value="1,1"/>
		</attributes>
		<level value="199"/>
		<experience value="9910"/>
		<respawn value="9510"/>
		<corpse name="animal"/>
		<drops>
			<item value="money" quantity="[9,329]" probability="100.0"/>
			<item value="sapphire" quantity="[1,1]" probability="11.0"/>
			<item value="golden blade" quantity="[1,1]" probability="0.05"/>
			<item value="greater antidote" quantity="[1,7]" probability="17.0"/>
			<item value="chaos cloak" quantity="[1,1]" probability="0.25"/>
		</drops>
		<equips/>
		<ai>
			<profile name="brave"/>
			<profile name="offensive"/>
			<profile name="human"/>
			<profile name="heal" params="10,60"/>
			<profile name="patrolling"/>
		</ai>
	</creature>

	<!-- END: wilkolaki -->

</creatures>