<?xml version="1.0" encoding="UTF-8"?>
<creatures xmlns="stendhal" xmlns:xsi="http://www.w3.org/2001/XMLSchema-instance"
	xsi:schemaLocation="stendhal ../creatures.xsd ">

	<!-- START: pokutniki -->

	<creature name="marsh penitent">
		<type class="pol/pokutniki" subclass="pit_pokutnik_bronz" tileid="pol_pokutniki.png:0"/>
		<description>You see a sorrowful marsh penitent seeking redemption.</description>
		<attributes>
			<atk value="400"/>
			<def value="33"/>
			<hp value="2900"/>
			<speed value="1.0"/>
			<size value="2,2"/>
		</attributes>
		<level value="120"/>
		<experience value="21321"/>
		<respawn value="10101"/>
		<corpse name="giant_knight"/>
		<drops>
			<item value="greater potion" quantity="[1,2]" probability="80.0"/>
			<item value="money" quantity="[30,200]" probability="100.0"/>
			<item value="red gloves" quantity="[1,1]" probability="2.5"/>
		</drops>
		<equips/>
		<ai>
			<profile name="brave"/>
			<profile name="animal"/>
			<profile name="offensive"/>
			<profile name="heal" params="5,25"/>
			<profile name="attack weakest"/>
		</ai>
	</creature>

	<creature name="moorland penitent">
		<type class="pol/pokutniki" subclass="pit_pokutnik_fiolet" tileid="pol_pokutniki.png:1"/>
		<description>You see a burdened moorland penitent wandering the heather.</description>
		<attributes>
			<atk value="410"/>
			<def value="34"/>
			<hp value="3000"/>
			<speed value="1.0"/>
			<size value="2,2"/>
		</attributes>
		<level value="125"/>
		<experience value="22321"/>
		<respawn value="10101"/>
		<corpse name="giant_knight"/>
		<drops>
			<item value="greater potion" quantity="[1,2]" probability="80.0"/>
			<item value="money" quantity="[30,200]" probability="100.0"/>
			<item value="shadow gloves" quantity="[1,1]" probability="0.5"/>
		</drops>
		<equips/>
		<ai>
			<profile name="brave"/>
			<profile name="animal"/>
			<profile name="offensive"/>
			<profile name="heal" params="5,25"/>
			<profile name="attack weakest"/>
		</ai>
	</creature>

	<creature name="night penitent">
		<type class="pol/pokutniki" subclass="pit_pokutnik_granat" tileid="pol_pokutniki.png:2"/>
		<description>You see a dark night penitent shrouded in remorse.</description>
		<attributes>
			<atk value="420"/>
			<def value="35"/>
			<hp value="3100"/>
			<speed value="1.0"/>
			<size value="2,2"/>
		</attributes>
		<level value="130"/>
		<experience value="23321"/>
		<respawn value="10101"/>
		<corpse name="giant_knight"/>
		<drops>
			<item value="greater potion" quantity="[1,2]" probability="80.0"/>
			<item value="money" quantity="[30,200]" probability="100.0"/>
			<item value="blue gloves" quantity="[1,1]" probability="2.5"/>
		</drops>
		<equips/>
		<ai>
			<profile name="brave"/>
			<profile name="animal"/>
			<profile name="offensive"/>
			<profile name="heal" params="5,25"/>
			<profile name="attack weakest"/>
		</ai>
	</creature>

	<creature name="dusk penitent">
		<type class="pol/pokutniki" subclass="pit_pokutnik_szary" tileid="pol_pokutniki.png:3"/>
		<description>You see an ashen dusk penitent lingering in twilight.</description>
		<attributes>
			<atk value="430"/>
			<def value="36"/>
			<hp value="3200"/>
			<speed value="1.0"/>
			<size value="2,2"/>
		</attributes>
		<level value="135"/>
		<experience value="24321"/>
		<respawn value="10101"/>
		<corpse name="giant_knight"/>
		<drops>
			<item value="greater potion" quantity="[1,2]" probability="80.0"/>
			<item value="money" quantity="[30,200]" probability="100.0"/>
			<item value="ice gloves" quantity="[1,1]" probability="0.5"/>
		</drops>
		<equips/>
		<ai>
			<profile name="brave"/>
			<profile name="animal"/>
			<profile name="offensive"/>
			<profile name="heal" params="5,25"/>
			<profile name="attack weakest"/>
		</ai>
	</creature>

	<creature name="meadow penitent">
		<type class="pol/pokutniki" subclass="pit_pokutnik_zielen" tileid="pol_pokutniki.png:4"/>
		<description>You see a green meadow penitent burdened with eternal grief.</description>
		<attributes>
			<atk value="450"/>
			<def value="37"/>
			<hp value="3300"/>
			<speed value="1.0"/>
			<size value="2,2"/>
		</attributes>
		<level value="150"/>
		<experience value="25321"/>
		<respawn value="10101"/>
		<corpse name="giant_knight"/>
		<drops>
			<item value="greater potion" quantity="[1,2]" probability="80.0"/>
			<item value="money" quantity="[30,200]" probability="100.0"/>
			<item value="elvish shield" quantity="[1,1]" probability="12.5"/>
		</drops>
		<equips/>
		<ai>
			<profile name="brave"/>
			<profile name="animal"/>
			<profile name="offensive"/>
			<profile name="heal" params="5,25"/>
			<profile name="attack weakest"/>
		</ai>
	</creature>

	<!-- END: pokutniki -->

</creatures>