<?xml version="1.0" encoding="UTF-8"?>
<creatures xmlns="stendhal" xmlns:xsi="http://www.w3.org/2001/XMLSchema-instance"
	xsi:schemaLocation="stendhal ../creatures.xsd ">

	<!-- START: elf gorski -->

	<creature name="mountain elf page">
		<type class="pol/elfy_gorskie" subclass="ae_elf_gorski_maskotka" tileid="pol_elfy_gorskie.png:0"/>
		<description>You see a young mountain elf page clutching a toy.</description>
		<attributes>
			<atk value="180"/>
			<def value="17"/>
			<hp value="120"/>
			<speed value="0.9"/>
			<size value="1,1"/>
		</attributes>
		<level value="35"/>
		<experience value="1210"/>
		<respawn value="1110"/>
		<corpse name="human"/>
		<drops>
			<item value="teddy" quantity="[1,1]" probability="1.0"/>
		</drops>
		<equips/>
		<ai>
			<profile name="coward"/>
			<profile name="offensive"/>
			<profile name="human"/>
			<profile name="patrolling"/>
		</ai>
	</creature>

	<creature name="mountain elf handmaiden">
		<type class="pol/elfy_gorskie" subclass="ae_elf_gorski_sluzka" tileid="pol_elfy_gorskie.png:1"/>
		<description>You see a gentle mountain elf handmaiden attending to court.</description>
		<attributes>
			<atk value="191"/>
			<def value="24"/>
			<hp value="150"/>
			<speed value="0.9"/>
			<size value="1,1"/>
		</attributes>
		<level value="37"/>
		<experience value="1310"/>
		<respawn value="1310"/>
		<corpse name="human"/>
		<drops>
			<item value="money" quantity="[1,159]" probability="19.0"/>
			<item value="cloth" quantity="[1,1]" probability="1.0"/>
		</drops>
		<equips/>
		<ai>
			<profile name="coward"/>
			<profile name="offensive"/>
			<profile name="human"/>
			<profile name="patrolling"/>
		</ai>
	</creature>

	<creature name="mountain elf noblewoman">
		<type class="pol/elfy_gorskie" subclass="ae_elf_gorski_dama" tileid="pol_elfy_gorskie.png:7"/>
		<description>You see an elegant mountain elf noblewoman in ornate robes.</description>
		<attributes>
			<atk value="193"/>
			<def value="26"/>
			<hp value="155"/>
			<speed value="0.8"/>
			<size value="1,1"/>
		</attributes>
		<level value="38"/>
		<experience value="1410"/>
		<respawn value="1510"/>
		<corpse name="human"/>
		<drops>
			<item value="money" quantity="[29,59]" probability="25.0"/>
		</drops>
		<equips/>
		<ai>
			<profile name="brave"/>
			<profile name="offensive"/>
			<profile name="human"/>
			<profile name="patrolling"/>
		</ai>
	</creature>

	<creature name="mountain elf sentry">
		<type class="pol/elfy_gorskie" subclass="ae_elf_gorski_strazniczka" tileid="pol_elfy_gorskie.png:9"/>
		<description>You see a vigilant mountain elf sentry guarding the mountain redoubt.</description>
		<attributes>
			<atk value="197"/>
			<def value="28"/>
			<hp value="177"/>
			<speed value="0.9"/>
			<size value="1,1"/>
		</attributes>
		<level value="40"/>
		<experience value="1510"/>
		<respawn value="1610"/>
		<corpse name="human"/>
		<drops>
			<item value="money" quantity="[29,39]" probability="20.0"/>
			<item value="elvish shield" quantity="[1,1]" probability="0.5"/>
		</drops>
		<equips/>
		<ai>
			<profile name="brave"/>
			<profile name="offensive"/>
			<profile name="human"/>
			<profile name="patrolling"/>
		</ai>
	</creature>
	<creature name="mountain elf captain">
		<type class="pol/elfy_gorskie" subclass="ae_elf_gorski_lider" tileid="pol_elfy_gorskie.png:6"/>
		<description>You see a seasoned mountain elf captain directing royal defenses.</description>
		<attributes>
			<atk value="205"/>
			<def value="33"/>
			<hp value="176"/>
			<speed value="0.9"/>
			<size value="1,1"/>
		</attributes>
		<level value="44"/>
		<experience value="1710"/>
		<respawn value="1910"/>
		<corpse name="human"/>
		<drops>
			<item value="money" quantity="[29,59]" probability="25.0"/>
			<item value="leather enhanced gloves" quantity="[1,1]" probability="30.0"/>
			<item value="elvish sword" quantity="[1,1]" probability="0.5"/>
		</drops>
		<equips/>
		<ai>
			<profile name="brave"/>
			<profile name="offensive"/>
			<profile name="human"/>
			<profile name="patrolling"/>
		</ai>
	</creature>

	<creature name="mountain elf warrior">
		<type class="pol/elfy_gorskie" subclass="ae_elf_gorski_wojownik" tileid="pol_elfy_gorskie.png:5"/>
		<description>You see a skilled mountain elf warrior armed with elven steel.</description>
		<attributes>
			<atk value="201"/>
			<def value="31"/>
			<hp value="188"/>
			<speed value="1.0"/>
			<size value="1,1"/>
		</attributes>
		<level value="44"/>
		<experience value="1610"/>
		<respawn value="1810"/>
		<corpse name="human"/>
		<drops>
			<item value="money" quantity="[29,59]" probability="25.0"/>
			<item value="elvish sword" quantity="[1,1]" probability="0.5"/>
			<item value="leather gloves" quantity="[1,1]" probability="2.5"/>
		</drops>
		<equips/>
		<ai>
			<profile name="brave"/>
			<profile name="offensive"/>
			<profile name="human"/>
			<profile name="patrolling"/>
		</ai>
	</creature>

	<creature name="mountain elf sorceress">
		<type class="pol/elfy_gorskie" subclass="ae_elf_gorski_czarwonica" tileid="pol_elfy_gorskie.png:11"/>
		<description>You see a mountain elf sorceress weaving elemental enchantments.</description>
		<attributes>
			<atk value="207"/>
			<def value="30"/>
			<hp value="132"/>
			<speed value="0.9"/>
			<size value="1,1"/>
		</attributes>
		<level value="45"/>
		<experience value="2010"/>
		<respawn value="2110"/>
		<corpse name="human"/>
		<drops>
			<item value="money" quantity="[29,59]" probability="25.0"/>
		</drops>
		<equips/>
		<ai>
			<profile name="brave"/>
			<profile name="offensive"/>
			<profile name="human"/>
			<profile name="patrolling"/>
		</ai>
	</creature>

	<creature name="mountain elf priest">
		<type class="pol/elfy_gorskie" subclass="ae_elf_gorski_kaplan" tileid="pol_elfy_gorskie.png:3"/>
		<description>You see a devout mountain elf priest reciting sacred chants.</description>
		<attributes>
			<atk value="200"/>
			<def value="39"/>
			<hp value="199"/>
			<speed value="0.5"/>
			<size value="1,1"/>
		</attributes>
		<level value="45"/>
		<experience value="1910"/>
		<respawn value="2010"/>
		<corpse name="human"/>
		<drops>
			<item value="money" quantity="[29,59]" probability="25.0"/>
			<item value="water" quantity="[1,1]" probability="45.0"/>
			<item value="leather enhanced gloves" quantity="[1,1]" probability="2.5"/>
		</drops>
		<equips/>
		<ai>
			<profile name="brave"/>
			<profile name="offensive"/>
			<profile name="human"/>
			<profile name="patrolling"/>
		</ai>
	</creature>

	<creature name="mountain elf warlock">
		<type class="pol/elfy_gorskie" subclass="ae_elf_gorski_czarnoksieznik" tileid="pol_elfy_gorskie.png:2"/>
		<description>You see a mountain elf warlock wielding dark mountain magic.</description>
		<attributes>
			<atk value="201"/>
			<def value="41"/>
			<hp value="198"/>
			<speed value="0.3"/>
			<size value="1,1"/>
		</attributes>
		<level value="46"/>
		<experience value="2110"/>
		<respawn value="2010"/>
		<corpse name="human"/>
		<drops>
			<item value="money" quantity="[59,89]" probability="25.0"/>
		</drops>
		<equips/>
		<ai>
			<profile name="brave"/>
			<profile name="offensive"/>
			<profile name="human"/>
			<profile name="patrolling"/>
		</ai>
	</creature>

	<creature name="mountain elf queen">
		<type class="pol/elfy_gorskie" subclass="ae_elf_gorski_krolowa" tileid="pol_elfy_gorskie.png:4"/>
		<description>You see the majestic Queen of the mountain elves.</description>
		<attributes>
			<atk value="210"/>
			<def value="38"/>
			<hp value="230"/>
			<speed value="0.8"/>
			<size value="1,1"/>
		</attributes>
		<level value="51"/>
		<experience value="2810"/>
		<respawn value="3010"/>
		<corpse name="human"/>
		<drops>
			<item value="money" quantity="[99,189]" probability="5.0"/>
		</drops>
		<equips/>
		<ai>
			<profile name="brave"/>
			<profile name="offensive"/>
			<profile name="human"/>
			<profile name="patrolling"/>
		</ai>
	</creature>

	<creature name="mountain elf king">
		<type class="pol/elfy_gorskie" subclass="ae_elf_gorski_krol" tileid="pol_elfy_gorskie.png:8"/>
		<description>You see the noble King of the mountain elves.</description>
		<attributes>
			<atk value="220"/>
			<def value="39"/>
			<hp value="240"/>
			<speed value="0.9"/>
			<size value="1,1"/>
		</attributes>
		<level value="52"/>
		<experience value="2910"/>
		<respawn value="3010"/>
		<corpse name="human"/>
		<drops>
			<item value="money" quantity="[99,199]" probability="10.0"/>
		</drops>
		<equips/>
		<ai>
			<profile name="brave"/>
			<profile name="offensive"/>
			<profile name="human"/>
			<profile name="patrolling"/>
		</ai>
	</creature>

	<creature name="mountain elf high lord">
		<type class="pol/elfy_gorskie" subclass="ae_elf_gorski_lord" tileid="pol_elfy_gorskie.png:10"/>
		<description>You see the supreme High Lord of the mountain elf realm.</description>
		<attributes>
			<atk value="250"/>
			<def value="49"/>
			<hp value="290"/>
			<speed value="1.0"/>
			<size value="1,1"/>
		</attributes>
		<level value="59"/>
		<experience value="3110"/>
		<respawn value="3110"/>
		<corpse name="human"/>
		<drops>
			<item value="money" quantity="[9,29]" probability="100.0"/>
			<item value="plate gloves" quantity="[1,1]" probability="0.25"/>
			<item value="blue armor" quantity="[1,1]" probability="0.05"/>
		</drops>
		<equips/>
		<ai>
			<profile name="brave"/>
			<profile name="offensive"/>
			<profile name="human"/>
			<profile name="patrolling"/>
		</ai>
	</creature>

	<!-- END: elf gorski -->

</creatures>