<?xml version="1.0" encoding="ISO-8859-1"?>

<creatures xmlns="stendhal" xmlns:xsi="http://www.w3.org/2001/XMLSchema-instance"
		xsi:schemaLocation="stendhal ../creatures.xsd">

	<creature name="chick">
		<type class="fowl" subclass="chick" tileid="fowl.png:0"/>
		<description>You see a little chick, it doesn't like to be away from its mother.</description>
		<attributes>
			<atk value="32"/>
			<def value="7"/>
			<hp value="25"/>
			<speed value="0.5"/>
			<size value="1,1"/>
		</attributes>
		<level value="1"/>
		<experience value="5"/>
		<respawn value="900"/>
		<corpse name="small_winged" harmless="feathered"/>
		<drops>
			<item value="chicken" quantity="[1,1]" probability="70.0"/>
			<item value="small feather" quantity="[1,1]" probability="50.0"/>
		</drops>
		<equips>
		</equips>
		<ai>
			<says>
				<noise state="idle follow fight" value="peep peep"/>
				<noise state="idle follow fight" value="peep peep peep"/>
				<sound value="chicken-chick-1"/>
				<sound value="chicken-chick-2"/>
			</says>
			<profile name="animal"/>
			<profile name="patrolling"/>
			<profile name="coward"/>
		</ai>
	</creature>

	<creature name="chicken">
		<type class="fowl" subclass="chicken" tileid="fowl.png:1"/>
		<description>You see a chicken, isn't it nice?</description>
		<attributes>
			<atk value="32"/>
			<def value="7"/>
			<hp value="25"/>
			<speed value="0.5"/>
			<size value="1,1"/>
		</attributes>
		<level value="1"/>
		<experience value="10"/>
		<respawn value="900"/>
	<corpse name="small_winged" harmless="feathered"/>
		<drops>
			<item value="chicken" quantity="[1,2]" probability="50.0"/>
			<item value="egg" quantity="1" probability="15.0"/>
			<item value="small feather" quantity="[1,2]" probability="60.0"/>
		</drops>
		<equips>
		</equips>
		<ai>
			<says>
				<noise state="idle follow fight" value="cluck cluck cluck"/>
				<noise state="idle follow fight" value="cluck cluck"/>
				<sound value="chicken-01"/>
				<sound value="chicken-02"/>
				<sound value="chicken-03"/>
			</says>
			<profile name="animal"/>
			<profile name="patrolling"/>
			<profile name="coward"/>
		</ai>
	</creature>

		<creature name="dodo">
		<type class="fowl" subclass="dodo_bird" tileid="fowl.png:3"/>
		<description>You see a dodo bird, aren't they supposed to be extinct?</description>
		<attributes>
			<atk value="57"/>
			<def value="14"/>
			<hp value="45"/>
			<speed value="0.7"/>
			<size value="1,1"/>
		</attributes>
		<level value="3"/>
		<experience value="30"/>
		<respawn value="900"/>
		<corpse name="small_winged" harmless="feathered"/>
		<drops>
			<item value="chicken" quantity="[1,3]" probability="60.0"/>
			<item value="spinach" quantity="[1,1]" probability="20.0"/>
			<item value="small feather" quantity="[1,3]" probability="70.0"/>
		</drops>
		<equips>
		</equips>
		<ai>
			<says>
				<noise state="idle follow fight" value="Bawk Bawk"/>
				<noise state="idle follow fight" value="Bawwwk"/>
				<sound value="bird-dodo-01"/>
			</says>
			<profile name="animal"/>
			<profile name="patrolling"/>
		</ai>
	</creature>

	<creature name="mother hen">
		<type class="fowl" subclass="hen" tileid="fowl.png:2"/>
		<description>You see a mother hen, she will probably hurt you if you touch her sons.</description>
		<attributes>
			<atk value="29"/>
			<def value="6"/>
			<hp value="25"/>
			<speed value="0.7"/>
			<size value="1,1"/>
		</attributes>
		<level value="1"/>
		<experience value="5"/>
		<respawn value="900"/>
		<corpse name="small_winged" harmless="feathered"/>
		<drops>
			<item value="chicken" quantity="[1,2]" probability="70.0"/>
			<item value="egg" quantity="[1,2]" probability="20.0"/>
			<item value="small feather" quantity="[1,2]" probability="60.0"/>
		</drops>
		<equips>
		</equips>
		<ai>
			<says>
				<noise state="idle follow fight" value="peep peep"/>
				<noise state="idle follow fight" value="peep peep peep"/>
				<sound value="chicken-01"/>
				<sound value="chicken-02"/>
				<sound value="chicken-03"/>
			</says>
			<profile name="animal"/>
			<profile name="patrolling"/>
		</ai>
	</creature>

	<creature name="penguin">
		<type class="fowl" subclass="penguin" tileid="fowl.png:5"/>
		<description>You see a penguin, smart and silly.</description>
		<attributes>
			<atk value="36"/>
			<def value="7"/>
			<hp value="20"/>
			<speed value="0.5"/>
			<size value="1,1"/>
		</attributes>
		<level value="1"/>
		<experience value="10"/>
		<respawn value="900"/>
		<corpse name="small_animal" harmless="feathered"/>
		<drops>
			<item value="chicken" quantity="[2,4]" probability="60.0"/>
			<item value="cod" quantity="[2,3]" probability="30.0"/>
			<item value="small feather" quantity="[1,2]" probability="50.0"/>
		</drops>
		<equips>
		</equips>
		<ai>
			<says>
				<noise state="idle follow fight" value="Oou! Oou!"/>
				<noise state="idle follow fight" value="*flap* *flap*"/>
				<sound value="penguin-1"/>
				<sound value="penguin-2"/>
			</says>
			<profile name="animal"/>
			<profile name="offensive"/>
			<profile name="patrolling"/>
		</ai>
	</creature>

	<creature name="pigeon">
		<type class="fowl" subclass="pigeon" tileid="fowl.png:4"/>
		<description>You see a pigeon, it loves the little seeds.</description>
		<attributes>
			<atk value="36"/>
			<def value="7"/>
			<hp value="20"/>
			<speed value="0.5"/>
			<size value="1,1"/>
		</attributes>
		<level value="1"/>
		<experience value="10"/>
		<respawn value="900"/>
		<corpse name="small_winged" harmless="feathered"/>
		<drops>
			<item value="chicken" quantity="[1,2]" probability="40.0"/>
			<item value="small feather" quantity="[1,2]" probability="60.0"/>
		</drops>
		<equips>
		</equips>
		<ai>
			<says>
				<sound value="bird-pigeon-1"/>
				<sound value="bird-pigeon-flap-1"/>
			</says>
			<profile name="animal"/>
			<profile name="patrolling"/>
			<profile name="coward"/>
		</ai>
	</creature>

</creatures>
