<?xml version="1.0" encoding="UTF-8"?>
<creatures xmlns="stendhal" xmlns:xsi="http://www.w3.org/2001/XMLSchema-instance"
	xsi:schemaLocation="stendhal ../creatures.xsd ">

	<!-- START: ptaki -->

	<creature name="city pigeon">
		<type class="pol/ptaki" subclass="golabek" tileid="pol_ptaki.png:0"/>
		<description>You see a little pigeon with a sharp beak, looking for breadcrumbs!</description>
		<attributes>
			<atk value="3"/>
			<def value="9"/>
			<hp value="12"/>
			<speed value="0.4"/>
			<size value="1,1"/>
		</attributes>
		<level value="1"/>
		<experience value="8"/>
		<respawn value="700"/>
		<corpse name="corpse"/>
		<drops>
			<item value="chicken" quantity="[1,1]" probability="80.0"/>
		</drops>
		<ai>
			<says>
				<sound value="pol-bird_pigeon"/>
			</says>
			<profile name="coward"/>
			<profile name="animal"/>
			<profile name="offensive"/>
			<profile name="patrolling"/>
		</ai>
	</creature>

	<creature name="seagull">
		<type class="pol/ptaki" subclass="mewa" tileid="pol_ptaki.png:2"/>
		<description>You see a screeching seagull.</description>
		<attributes>
			<atk value="15"/>
			<def value="9"/>
			<hp value="56"/>
			<speed value="0.8"/>
			<size value="1,1"/>
		</attributes>
		<level value="3"/>
		<experience value="30"/>
		<respawn value="999"/>
		<corpse name="corpse"/>
		<drops>
			<item value="sandwich" quantity="[1,1]" probability="2.0"/>
			<item value="cod" quantity="[1,1]" probability="20.0"/>
			<item value="perch" quantity="[1,1]" probability="10.0"/>
		</drops>
		<ai>
			<says>
				<sound value="pol-seagull"/>
			</says>
			<profile name="brave"/>
			<profile name="offensive"/>
			<profile name="patrolling"/>
		</ai>
	</creature>

	<creature name="raven">
		<type class="pol/ptaki" subclass="kruk" tileid="pol_ptaki.png:1"/>
		<description>You see an intelligent black raven.</description>
		<attributes>
			<atk value="20"/>
			<def value="11"/>
			<hp value="64"/>
			<speed value="0.8"/>
			<size value="1,1"/>
		</attributes>
		<level value="6"/>
		<experience value="62"/>
		<respawn value="904"/>
		<corpse name="corpse"/>
		<drops>
			<item value="cheese" quantity="[1,1]" probability="100.0"/>
			<item value="goat cheese" quantity="[1,1]" probability="5.0"/>
		</drops>
		<ai>
			<says>
				<sound value="pol-crow" />
			</says>
			<profile name="brave"/>
			<profile name="offensive"/>
			<profile name="patrolling"/>
		</ai>
	</creature>

	<creature name="hawk">
		<type class="pol/ptaki" subclass="jastrzab" tileid="pol_ptaki.png:3"/>
		<description>You see a sharp-eyed hunting hawk.</description>
		<attributes>
			<atk value="33"/>
			<def value="99"/>
			<hp value="127"/>
			<speed value="0.8"/>
			<size value="1,1"/>
		</attributes>
		<level value="21"/>
		<experience value="302"/>
		<respawn value="999"/>
		<corpse name="corpse"/>
		<drops>
			<item value="chicken" quantity="[1,1]" probability="80.0"/>
		</drops>
		<ai>
			<says>
				<sound value="pol-hawk1"/>
				<sound value="pol-hawk2"/>
			</says>
			<profile name="brave"/>
			<profile name="offensive"/>
			<profile name="patrolling"/>
		</ai>
	</creature>

	<!-- END: ptaki -->

</creatures>