<?xml version="1.0" encoding="UTF-8"?>
<creatures xmlns="stendhal" xmlns:xsi="http://www.w3.org/2001/XMLSchema-instance"
	xsi:schemaLocation="stendhal ../creatures.xsd ">

	<!-- START: pasterze -->

	<creature name="treant shepherd">
		<type class="pol/pasterze_drzew" subclass="pasterz_drzew" tileid="pol_pasterze_drzew.png:0"/>
		<description>You see an ancient treant shepherd guarding the deep forests.</description>
		<attributes>
			<atk value="919"/>
			<def value="193"/>
			<hp value="1250"/>
			<speed value="0.1"/>
			<size value="2,2"/>
		</attributes>
		<level value="213"/>
		<experience value="20000"/>
		<respawn value="6200"/>
		<corpse name="flora_ent" width="2" height="1"/>
		<drops>
			<item value="wood" quantity="[1,4]" probability="22.0"/>
		</drops>
		<equips>
		</equips>
		<ai>
			<profile name="brave"/>
			<profile name="offensive"/>
			<profile name="human"/>
			<profile name="heal" params="30,50"/>
			<profile name="patrolling"/>
		</ai>
	</creature>

	<!-- END: pasterze -->

</creatures>