<?xml version="1.0" encoding="ISO-8859-1"?>

<creatures xmlns="stendhal" xmlns:xsi="http://www.w3.org/2001/XMLSchema-instance"
    xsi:schemaLocation="stendhal ../creatures.xsd">

  <creature name="black slime">
    <type class="slime" subclass="black_slime" tileid="slime.png:2"/>
    <description>You see a black slime, with a sticky trail behind it.</description>
    <attributes>
      <atk value="250"/>
      <def value="36"/>
      <hp value="210"/>
      <speed value="0.5"/>
      <size value="1,1"/>
    </attributes>
    <level value="24"/>
    <experience value="370"/>
    <respawn value="1290"/>
    <corpse name="puddle_black" harmless="puddle_black"/>
    <drops>
    </drops>
    <equips>
    </equips>
    <ai>
      <says>
        <movement value="loop-drag-slimy-1"/>
      </says>
      <profile name="brave"/>
      <profile name="offensive"/>
      <profile name="human"/>
      <profile name="patrolling"/>
    </ai>
  </creature>

  <creature name="brown slime">
    <type class="slime" subclass="brown_slime" tileid="slime.png:1"/>
    <description>You see a brown slime, sticky and hungry.</description>
    <attributes>
      <atk value="184"/>
      <def value="26"/>
      <hp value="160"/>
      <speed value="0.4"/>
      <size value="1,1"/>
    </attributes>
    <level value="16"/>
    <experience value="200"/>
    <respawn value="1230"/>
    <corpse name="puddle_brown" harmless="puddle_brown"/>
    <drops>
    </drops>
    <equips>
    </equips>
    <ai>
      <says>
        <movement value="loop-drag-slimy-1"/>
      </says>
      <profile name="brave"/>
      <profile name="offensive"/>
      <profile name="human"/>
      <profile name="patrolling"/>
    </ai>
  </creature>

  <creature name="green slime">
    <type class="slime" subclass="green_slime" tileid="slime.png:0"/>
    <description>You see a green slime, sticky and shiny.</description>
    <attributes>
      <atk value="114"/>
      <def value="18"/>
      <hp value="90"/>
      <speed value="0.3"/>
      <size value="1,1"/>
    </attributes>
    <level value="8"/>
    <experience value="80"/>
    <respawn value="1200"/>
    <corpse name="puddle_green" harmless="puddle_green"/>
    <drops>
    </drops>
    <equips>
    </equips>
    <ai>
      <says>
        <movement value="loop-drag-slimy-1"/>
      </says>
      <profile name="brave"/>
      <profile name="offensive"/>
      <profile name="human"/>
      <profile name="patrolling"/>
    </ai>
  </creature>

  <creature name="twilight slime">
    <type class="slime" subclass="twilight_slime" tileid="animal.png:-1"/>
    <description>You see a twilight slime, so strange and beautiful. Why is it coming towards you? Runnnnnnnnn!</description>
    <attributes>
      <atk value="718"/>
      <def value="88"/>
      <hp value="1290"/>
      <speed value="0.5"/>
      <size value="1,1"/>
    </attributes>
    <level value="111"/>
    <experience value="14580"/>
    <respawn value="1200"/>
    <corpse name="puddle_light_blue" harmless="puddle_light_blue"/>
    <drops>
      <item value="greater antidote" quantity="[1,1]" probability="100.0"/>
    </drops>
    <equips>
    </equips>
    <ai>
      <says>
        <movement value="loop-drag-slimy-1"/>
      </says>
      <profile name="brave"/>
      <profile name="offensive"/>
      <profile name="human"/>
      <profile name="patrolling"/>
      <profile name="abnormal"/>
    </ai>
  </creature>

</creatures>
